{
  "metric": "bytes_per_op",
  "unit": "B/op",
  "direction": "smaller_is_better",
  "series": {
    "BenchmarkSort [procs=4]": {
      "tags": {
        "procs": "4"
      },
      "points": [
        {
          "timestamp": "2026-03-31T01:52:00.724Z",
          "value": 48,
          "commit": "a1f69ae44a2a8ff9c5dbdaae3b0b39ef629a8737",
          "run_id": "test-count-23776650725-1",
          "range": 0
        },
        {
          "timestamp": "2026-03-31T01:56:07.047Z",
          "value": 48,
          "commit": "d7d1bffe28b867a1640c486c4e7d662d47998037",
          "run_id": "test-count-23776752150-1",
          "range": 0
        },
        {
          "timestamp": "2026-03-31T01:56:08.126Z",
          "value": 48,
          "commit": "d7d1bffe28b867a1640c486c4e7d662d47998037",
          "run_id": "test-go-23776752150-1"
        }
      ]
    },
    "BenchmarkSearch [procs=4]": {
      "tags": {
        "procs": "4"
      },
      "points": [
        {
          "timestamp": "2026-03-31T01:52:00.724Z",
          "value": 0,
          "commit": "a1f69ae44a2a8ff9c5dbdaae3b0b39ef629a8737",
          "run_id": "test-count-23776650725-1",
          "range": 0
        },
        {
          "timestamp": "2026-03-31T01:56:07.047Z",
          "value": 0,
          "commit": "d7d1bffe28b867a1640c486c4e7d662d47998037",
          "run_id": "test-count-23776752150-1",
          "range": 0
        },
        {
          "timestamp": "2026-03-31T01:56:08.126Z",
          "value": 0,
          "commit": "d7d1bffe28b867a1640c486c4e7d662d47998037",
          "run_id": "test-go-23776752150-1"
        }
      ]
    },
    "BenchmarkInsert [procs=4]": {
      "tags": {
        "procs": "4"
      },
      "points": [
        {
          "timestamp": "2026-03-31T01:56:08.126Z",
          "value": 64,
          "commit": "d7d1bffe28b867a1640c486c4e7d662d47998037",
          "run_id": "test-go-23776752150-1"
        }
      ]
    }
  }
}
